{
  "$schema":"https://dsh.community/schemas/dsh-plugin-0.15.json",
  "id":"com.example.future",
  "name":"Future Contract Plugin",
  "version":"0.1.0",
  "manifestVersion":"0.15",
  "facets":{"host":{"entry":"dist/main.js","apiVersion":"v1alpha1"}},
  "requires":{"contracts":[
    {"apiVersion":"storage.dsh/v2beta1","kind":"LocalStorage"}
  ]},
  "permissions":[{"name":"storage.local.read","scope":"com.example.future","reason":"read plugin storage"}],
  "contributes":{"commands":[]},
  "subscriptions":[],
  "license":"MIT",
  "source":{"repository":"https://example.com/future"}
}
