{
  "$schema":"https://dsh.community/schemas/dsh-plugin-0.15.json",
  "id":"com.example.observer",
  "name":"Coordinate Subscription Plugin",
  "version":"0.1.0",
  "manifestVersion":"0.15",
  "facets":{"host":{"entry":"dist/main.js","apiVersion":"v1alpha1"}},
  "requires":{"contracts":[
    {"apiVersion":"commands.dsh/v1alpha1","kind":"Command"}
  ]},
  "permissions":[{"name":"commands.invoke","scope":"com.example.observer.run","reason":"invoke the declared action"}],
  "contributes":{"commands":[{"id":"com.example.observer.run","title":"Run"}]},
  "subscriptions":[{"apiVersion":"messages.dsh/v1alpha1","kind":"MessageObserver","scope":"session:*"}],
  "license":"MIT",
  "source":{"repository":"https://example.com/observer","revision":"abc123"}
}
