{
  "$schema":"https://dsh.community/schemas/dsh-plugin-0.15.json",
  "id":"com.example.observer",
  "name":"Observer",
  "version":"0.1.0",
  "manifestVersion":"0.15",
  "facets":{"host":{"entry":"dist/main.js","apiVersion":"v1alpha1"}},
  "requires":{"contracts":[
    {"apiVersion":"messages.dsh/v1alpha1","kind":"MessageObserver"}
  ]},
  "permissions":[{"name":"messages.observe.read","scope":"session:*","reason":"observe message metadata"}],
  "contributes":{"commands":[]},
  "subscriptions":[{"apiVersion":"messages.dsh/v1alpha1","kind":"MessageObserver","scope":"session:*"}],
  "license":"MIT",
  "source":{"repository":"https://example.com/observer"}
}
